id,company,track,title,url,publish_date,authors,in_scope,scope_reason
dbx-r-agentic-reasoning-practice-making-sense-structured-and-unstructured-data,databricks,research,Agentic Reasoning in Practice: Making Sense of Structured and Unstructured Data,https://www.databricks.com/blog/agentic-reasoning-practice-making-sense-structured-and-unstructured-data,2026-04-14,The Databricks AI Research Team,TRUE,
dbx-r-memory-scaling-ai-agents,databricks,research,Memory Scaling for AI Agents,https://www.databricks.com/blog/memory-scaling-ai-agents,2026-04-10,The Databricks AI Research Team,TRUE,
dbx-r-meet-karl-faster-agent-enterprise-knowledge-powered-custom-rl,databricks,research,"Meet KARL: A Faster Agent for Enterprise Knowledge, powered by custom RL",https://www.databricks.com/blog/meet-karl-faster-agent-enterprise-knowledge-powered-custom-rl,2026-03-05,The Databricks AI Research Team,TRUE,
dbx-r-memalign-building-better-llm-judges-human-feedback-scalable-memory,databricks,research,MemAlign: Building Better LLM Judges From Human Feedback With Scalable Memory,https://www.databricks.com/blog/memalign-building-better-llm-judges-human-feedback-scalable-memory,2026-02-03,The Databricks AI Research Team,TRUE,
dbx-r-scaling-small-llms-nvidia-mps,databricks,research,Scaling Small LLMs with NVIDIA MPS,https://www.databricks.com/blog/scaling-small-llms-nvidia-mps,2026-01-26,The Databricks AI Research Team,TRUE,
dbx-r-instructed-retriever-unlocking-system-level-reasoning-search-agents,databricks,research,Instructed Retriever: Unlocking System-Level Reasoning in Search Agents,https://www.databricks.com/blog/instructed-retriever-unlocking-system-level-reasoning-search-agents,2026-01-06,The Databricks AI Research Team,TRUE,
dbx-r-introducing-officeqa-benchmark-end-to-end-grounded-reasoning,databricks,research,Introducing OfficeQA: A Benchmark for End-to-End Grounded Reasoning,https://www.databricks.com/blog/introducing-officeqa-benchmark-end-to-end-grounded-reasoning,2025-12-09,The Databricks AI Research Team,TRUE,
dbx-r-databricks-neurips-2025,databricks,research,Databricks at NeurIPS 2025,https://www.databricks.com/blog/databricks-neurips-2025,2025-12-01,Sam Plecque,TRUE,
dbx-r-pilot-production-custom-judges,databricks,research,From Pilot to Production with Custom Judges,https://www.databricks.com/blog/pilot-production-custom-judges,2025-11-04,The Databricks AI Research Team,TRUE,
dbx-e-fast-peft-serving-scale,databricks,engineering,Fast PEFT Serving at Scale,https://www.databricks.com/blog/fast-peft-serving-scale,2025-10-21,The Databricks AI Research Team,TRUE,
dbx-r-building-state-art-enterprise-agents-90x-cheaper-automated-prompt-optimization,databricks,research,Building State-of-the-Art Enterprise Agents 90x Cheaper with Automated Prompt Optimization,https://www.databricks.com/blog/building-state-art-enterprise-agents-90x-cheaper-automated-prompt-optimization,2025-09-24,The Databricks AI Research Team,TRUE,
dbx-r-judging-confidence-meet-pgrm-promptable-reward-model,databricks,research,"Judging with Confidence: Meet PGRM, the Promptable Reward Model",https://www.databricks.com/blog/judging-confidence-meet-pgrm-promptable-reward-model,2025-08-12,The Databricks AI Research Team,TRUE,
dbx-r-agent-learning-human-feedback-alhf-databricks-knowledge-assistant-case-study,databricks,research,Agent Learning from Human Feedback (ALHF): A Databricks Knowledge Assistant Case Study,https://www.databricks.com/blog/agent-learning-human-feedback-alhf-databricks-knowledge-assistant-case-study,2025-08-04,The Databricks AI Research Team,TRUE,
dbx-r-power-rlvr-training-leading-sql-reasoning-model-databricks,databricks,research,The Power of RLVR: Training a Leading SQL Reasoning Model on Databricks,https://www.databricks.com/blog/power-rlvr-training-leading-sql-reasoning-model-databricks,2025-07-30,The Databricks AI Research Team,TRUE,
dbx-r-power-fine-tuning-your-data-quick-fixing-bugs-llms-never-ending-learning-nel,databricks,research,The Power of Fine-Tuning on Your Data: Quick Fixing Bugs with LLMs via Never Ending Learning (NEL),https://www.databricks.com/blog/power-fine-tuning-your-data-quick-fixing-bugs-llms-never-ending-learning-nel,2025-04-08,Samantha Banchik|Ta-Chung Chi|Sam Havens|Dipendra Misra|Will Tipton|Jan van der Vegt|Matei Zaharia|Emanuel Zgraggen,TRUE,
dbx-r-tao-using-test-time-compute-train-efficient-llms-without-labeled-data,databricks,research,TAO: Using test-time compute to train efficient LLMs without labeled data,https://www.databricks.com/blog/tao-using-test-time-compute-train-efficient-llms-without-labeled-data,2025-03-25,The Databricks AI Research Team,TRUE,
dbx-r-benchmarking-domain-intelligence,databricks,research,Benchmarking Domain Intelligence,https://www.databricks.com/blog/benchmarking-domain-intelligence,2024-12-17,Pallavi Koppol|Erica Ji Yuen|Kartik Sreenivasan|Andy Zhang|Sam Havens|Michael Carbin|Matei Zaharia|Jonathan Frankle,TRUE,
dbx-r-databricks-neurips-2024,databricks,research,Databricks at NeurIPS 2024,https://www.databricks.com/blog/databricks-neurips-2024,2024-12-09,Sam Plecque|Kobie Crawford|Emily Hutson,TRUE,
dbx-r-characterizing-datasets-and-building-better-models-continued-pre-training,databricks,research,Characterizing Datasets and Building Better Models with Continued Pre-Training,https://www.databricks.com/blog/characterizing-datasets-and-building-better-models-continued-pre-training,2024-11-21,Mansheej Paul|Brett Larsen|Connor Jennings|Cody Blakeney,TRUE,
dbx-r-long-context-rag-capabilities-openai-o1-and-google-gemini,databricks,research,The Long Context RAG Capabilities of OpenAI o1 and Google Gemini,https://www.databricks.com/blog/long-context-rag-capabilities-openai-o1-and-google-gemini,2024-10-08,Quinn Leng|Jacob Portes|Sam Havens|Matei Zaharia|Michael Carbin,TRUE,
dbx-r-mixattention,databricks,research,Inference-Friendly Models with MixAttention,https://www.databricks.com/blog/mixattention,2024-09-18,Shashank Rajput|Ying Sheng (Stanford University)|Sean Owen|Vitaliy Chiley,TRUE,
dbx-r-unpacking-function-calling-eval,databricks,research,Beyond the Leaderboard: Unpacking Function Calling Evaluation,https://www.databricks.com/blog/unpacking-function-calling-eval,2024-08-16,Kartik Sreenivasan|Jeffrey Chen|Pallavi Koppol|Eitan Turok|Bay Foley-Cox|Asfandyar Qureshi|Sam Havens,TRUE,
dbx-r-long-context-rag-performance-llms,databricks,research,Long Context RAG Performance of LLMs,https://www.databricks.com/blog/long-context-rag-performance-llms,2024-08-12,Quinn Leng|Jacob Portes|Sam Havens|Matei Zaharia|Michael Carbin,TRUE,
dbx-r-how-long-should-you-train-your-language-model,databricks,research,How Long Should You Train Your Language Model?,https://www.databricks.com/blog/how-long-should-you-train-your-language-model,2024-07-19,Nikhil Sardana|Jacob Portes|Sasha Doubov,TRUE,
dbx-e-training-moes-scale-pytorch-and-databricks,databricks,engineering,Training MoEs at Scale with PyTorch and Databricks,https://www.databricks.com/blog/training-moes-scale-pytorch-and-databricks,2024-07-01,Brian Chu|Mihir Patel|Vitaliy Chiley|Evan Racah,TRUE,
dbx-r-optimizing-databricks-llm-pipelines-dspy,databricks,research,Optimizing Databricks LLM Pipelines with DSPy,https://www.databricks.com/blog/optimizing-databricks-llm-pipelines-dspy,2024-05-23,Arnav Singhvi|Daniel Pechi (JetBlue),TRUE,
dbx-e-mosaic-ai-training-capabilities,databricks,engineering,Building DBRX-class Custom LLMs with Mosaic AI Training,https://www.databricks.com/blog/mosaic-ai-training-capabilities,2024-05-14,Anna Pfohl|Cheng Li|Mihir Patel|Wai Wu|Will Gleich|Ajay Saini|Hagay Lupesko,TRUE,
dbx-r-calibrating-mosaic-evaluation-gauntlet,databricks,research,Calibrating the Mosaic Evaluation Gauntlet,https://www.databricks.com/blog/calibrating-mosaic-evaluation-gauntlet,2024-04-30,Tessa Barton,TRUE,
dbx-e-bringing-megablocks-databricks,databricks,engineering,Bringing MegaBlocks to Databricks,https://www.databricks.com/blog/bringing-megablocks-databricks,2024-04-09,Mihir Patel|Trevor Gale|Vitaliy Chiley,TRUE,
dbx-r-dspy-databricks,databricks,research,DSPy on Databricks,https://www.databricks.com/blog/dspy-databricks,2024-04-08,Arnav Singhvi|Michael Carbin|Matei Zaharia,TRUE,
dbx-r-introducing-dbrx-new-state-art-open-llm,databricks,research,Introducing DBRX: A New State-of-the-Art Open LLM,https://www.databricks.com/blog/introducing-dbrx-new-state-art-open-llm,2024-03-27,The Databricks AI Research Team,TRUE,
dbx-e-turbocharged-training-optimizing-databricks-mosaic-ai-stack-fp8,databricks,engineering,Turbocharged Training: Optimizing the Databricks Mosaic AI Stack With FP8,https://www.databricks.com/blog/turbocharged-training-optimizing-databricks-mosaic-ai-stack-fp8,2024-03-21,Mihir Patel|Cheng Li|Davis Blalock|Saaketh Narayan,TRUE,
dbx-e-fast-secure-and-reliable-enterprise-grade-llm-inference,databricks,engineering,"Fast, Secure and Reliable: Enterprise-grade LLM Inference",https://www.databricks.com/blog/fast-secure-and-reliable-enterprise-grade-llm-inference,2024-03-20,Linden Li|Jeffrey Chen|Megha Agarwal|Margaret Qian|Daya Khudia,TRUE,
dbx-r-fine-grained-human-feedback,databricks,research,Fine-Grained Human Feedback,https://www.databricks.com/blog/fine-grained-human-feedback,2024-02-27,Prithviraj (Raj) Ammanabrolu,TRUE,
dbx-r-limit-less-more-instruction-tuning,databricks,research,LIMIT: Less Is More for Instruction Tuning,https://www.databricks.com/blog/limit-less-more-instruction-tuning,2024-02-10,Aditi Jha|Jacob Portes,TRUE,
dbx-r-ai2-olmo-is-here,databricks,research,"OLMo Is Here, Powered by Databricks",https://www.databricks.com/blog/ai2-olmo-is-here,2024-02-01,Jonathan Frankle,TRUE,
dbx-e-serving-quantized-llms-nvidia-h100-tensor-core-gpus,databricks,engineering,Serving Quantized LLMs on NVIDIA H100 Tensor Core GPUs,https://www.databricks.com/blog/serving-quantized-llms-nvidia-h100-tensor-core-gpus,2024-01-31,Nikhil Sardana|Julian Quevedo|Daya Khudia,TRUE,
dbx-e-llm-training-and-inference-intel-gaudi2-ai-accelerators,databricks,engineering,LLM Training and Inference with Intel Gaudi 2 AI Accelerators,https://www.databricks.com/blog/llm-training-and-inference-intel-gaudi2-ai-accelerators,2024-01-04,Abhi Venigalla|Daya Khudia,TRUE,
dbx-e-integrating-nvidia-tensorrt-llm,databricks,engineering,Integrating NVIDIA TensorRT-LLM with the Databricks Inference Stack,https://www.databricks.com/blog/Integrating-NVIDIA-TensorRT-LLM,2023-12-21,Linden Li|Megha Agarwal|Kobie Crawford|Daya Khudia,TRUE,
dbx-r-patronus-ai-using-llms-to-detect-business-sensitive-information,databricks,research,Patronus AI: Using LLMs to Detect Business-Sensitive Information,https://www.databricks.com/blog/patronus-ai-using-llms-to-detect-business-sensitive-information,2023-11-01,Emily Hutson,FALSE,customer-story
dbx-e-training-llms-scale-amd-mi250-gpus,databricks,engineering,Training LLMs at Scale with AMD MI250 GPUs,https://www.databricks.com/blog/training-llms-scale-amd-mi250-gpus,2023-10-30,Abhi Venigalla,TRUE,
dbx-e-llm-training-unity-catalog-data-mosaicml-streaming-dataset,databricks,engineering,LLM Training on Unity Catalog data with MosaicML Streaming Dataset,https://www.databricks.com/blog/llm-training-unity-catalog-data-mosaicml-streaming-dataset,2023-10-17,Xiaohan Zhang|Maddie Dawson|Karan Jariwala,TRUE,
dbx-e-llm-inference-performance-engineering-best-practices,databricks,engineering,LLM Inference Performance Engineering: Best Practices,https://www.databricks.com/blog/llm-inference-performance-engineering-best-practices,2023-10-12,Megha Agarwal|Asfandyar Qureshi|Nikhil Sardana|Linden Li|Julian Quevedo|Daya Khudia,TRUE,
dbx-r-llama2-inference,databricks,research,Introducing Llama2-70B-Chat with MosaicML Inference,https://www.databricks.com/blog/llama2-inference,2023-08-24,Hagay Lupesko|Margaret Qian|Daya Khudia|Sam Havens|Daniel King|Erica Ji Yuen,TRUE,
dbx-r-secure-code-evaluation,databricks,research,End-to-End Secure Evaluation of Code Generation Models,https://www.databricks.com/blog/secure-code-evaluation,2023-08-10,Rishab Parthasarathy,TRUE,
dbx-r-long-context-mpt-7b-8k,databricks,research,Announcing MPT-7B-8K: 8K Context Length for Document Understanding,https://www.databricks.com/blog/long-context-mpt-7b-8k,2023-07-18,Sam Havens|Erica Ji Yuen,TRUE,
dbx-e-amd-mi250,databricks,engineering,Training LLMs with AMD MI250 GPUs and MosaicML,https://www.databricks.com/blog/amd-mi250,2023-06-30,Abhi Venigalla,TRUE,
dbx-r-mpt-30b,databricks,research,MPT-30B: Raising the bar for open-source foundation models,https://www.databricks.com/blog/mpt-30b,2023-06-22,The Databricks AI Research Team,TRUE,
dbx-r-introducing-ai2-olmo,databricks,research,Introducing AI2 OLMo (Open Language Model),https://www.databricks.com/blog/introducing-ai2-olmo,2023-06-02,Jonathan Frankle,TRUE,
dbx-e-cloudflare-r2-mosaicml,databricks,engineering,Cloudflare R2 and MosaicML: Train LLMs on Any Compute with Zero Switching Costs,https://www.databricks.com/blog/cloudflare-r2-mosaicml,2023-05-23,Abhinav Venigalla,TRUE,
dbx-r-mpt-7b,databricks,research,"Introducing MPT-7B: A New Standard for Open-Source, Commercially Usable LLMs",https://www.databricks.com/blog/mpt-7b,2023-05-05,The Databricks AI Research Team,TRUE,
dbx-r-diffusion,databricks,research,How We Trained Stable Diffusion for Less than $50k (Part 3),https://www.databricks.com/blog/diffusion,2023-04-28,Mihir Patel|Erica Ji Yuen|Cory Stephenson|Landan Seguin,TRUE,
dbx-e-coreweave-nvidia-h100-part-1,databricks,engineering,Benchmarking Large Language Models on NVIDIA H100 GPUs with CoreWeave (Part 1),https://www.databricks.com/blog/coreweave-nvidia-h100-part-1,2023-04-27,Daya Khudia|Vitaliy Chiley,TRUE,
dbx-r-stable-diffusion-2,databricks,research,Training Stable Diffusion from Scratch for <$50k with MosaicML (Part 2),https://www.databricks.com/blog/stable-diffusion-2,2023-04-26,Mihir Patel|Cory Stephenson|Landan Seguin|Austin Jacobson|Erica Ji Yuen,TRUE,
dbx-r-mosaicbert,databricks,research,MosaicBERT: Pretraining BERT from Scratch for $20,https://www.databricks.com/blog/mosaicbert,2023-03-09,Jacob Portes|Alex Trott|Daniel King|Sam Havens|Erica Ji Yuen,TRUE,
dbx-e-mosaicml-streamingdataset,databricks,engineering,"MosaicML StreamingDataset: Fast, Accurate Streaming of Training Data from Cloud Storage",https://www.databricks.com/blog/mosaicml-streamingdataset,2023-02-09,James Knighton|Karan Jariwala|Davis Blalock|Erica Ji Yuen,TRUE,
dbx-r-llm-evaluation-for-icl,databricks,research,Blazingly Fast LLM Evaluation for In-Context Learning,https://www.databricks.com/blog/llm-evaluation-for-icl,2023-02-02,Jeremy Dohmann,TRUE,
dbx-r-mosaic-image-segmentation,databricks,research,5x Faster Image Segmentation Training with MosaicML Recipes,https://www.databricks.com/blog/mosaic-image-segmentation,2022-11-17,Landan Seguin|Cory Stephenson|Erica Ji Yuen,TRUE,
dbx-r-mlperf-nlp-nov2022,databricks,research,MosaicML Delivers Leading NLP Performance in MLPerf v2.1,https://www.databricks.com/blog/mlperf-nlp-nov2022,2022-11-09,Daya Khudia|Nikhil Sardana|Sam Havens|Alex Trott|Erica Ji Yuen,TRUE,
dbx-r-gpt-3-quality-for-500k,databricks,research,Mosaic LLMs: GPT-3 quality for <$500k,https://www.databricks.com/blog/gpt-3-quality-for-500k,2022-09-29,Abhi Venigalla|Linden Li,TRUE,
dbx-e-billion-parameter-gpt-training-made-easy,databricks,engineering,Mosaic LLMs (Part 1): Billion-Parameter GPT Training Made Easy,https://www.databricks.com/blog/billion-parameter-gpt-training-made-easy,2022-08-11,Abhi Venigalla|Linden Li,TRUE,
dbx-r-behind-the-scenes,databricks,research,Behind the Scenes: Setting a Baseline for Image Segmentation Speedups,https://www.databricks.com/blog/behind-the-scenes,2022-07-28,Landan Seguin,TRUE,
dbx-r-mosaic-resnet-deep-dive,databricks,research,Mosaic ResNet Deep Dive,https://www.databricks.com/blog/mosaic-resnet-deep-dive,2022-07-18,Matthew Leavitt,TRUE,
dbx-r-mlperf-2022,databricks,research,MosaicML Satisfies the Need for Speed with MLPerf Results,https://www.databricks.com/blog/mlperf-2022,2022-06-29,Bandish Shah|Daya Khudia|Hanlin Tang,TRUE,
dbx-e-farewell-oom,databricks,engineering,"Farewell, CUDA OOM: Automatic Gradient Accumulation",https://www.databricks.com/blog/farewell-oom,2022-06-23,Mihir Patel|Erica Ji Yuen,TRUE,
dbx-r-mosaic-resnet,databricks,research,Blazingly Fast Computer Vision Training with the Mosaic ResNet and Composer,https://www.databricks.com/blog/mosaic-resnet,2022-06-09,Matthew Leavitt|Erica Ji Yuen|Kobie Crawford,TRUE,
dbx-r-efficiently-estimating-pareto-frontiers,databricks,research,Efficiently Estimating Pareto Frontiers with Cyclic Learning Rate Schedules,https://www.databricks.com/blog/efficiently-estimating-pareto-frontiers,2022-04-08,Jacob Portes,TRUE,
dbx-r-5-best-practices-for-efficient-model-training,databricks,research,5 Best Practices for Efficient Model Training,https://web.archive.org/web/2023/https://www.mosaicml.com/blog/5-best-practices-for-efficient-model-training,,,TRUE,migrated-lost
dbx-r-ai-models-critical-ip-1,databricks,research,AI Models are Critical IP (Part 1),https://web.archive.org/web/2023/https://www.mosaicml.com/blog/ai-models-critical-ip-1,,,FALSE,company-news
dbx-r-ai-models-critical-ip-2,databricks,research,AI Models are Critical IP (Part 2),https://web.archive.org/web/2023/https://www.mosaicml.com/blog/ai-models-critical-ip-2,,,FALSE,company-news
dbx-e-aws-composer,databricks,engineering,Composer on AWS,https://web.archive.org/web/2023/https://www.mosaicml.com/blog/aws-composer,,,TRUE,migrated-lost
dbx-r-best-practices-dec-2021,databricks,research,Best Practices (Dec 2021),https://web.archive.org/web/2023/https://www.mosaicml.com/blog/best-practices-dec-2021,,,TRUE,migrated-lost
dbx-e-build-ai-models-on-any-cloud-in-your-secure-environment,databricks,engineering,Build AI Models on Any Cloud in Your Secure Environment,https://web.archive.org/web/2023/https://www.mosaicml.com/blog/build-ai-models-on-any-cloud-in-your-secure-environment,,,FALSE,product-launch
dbx-e-comet,databricks,engineering,Comet Integration,https://web.archive.org/web/2023/https://www.mosaicml.com/blog/comet,,,FALSE,product-launch
dbx-e-composer-0-10-release,databricks,engineering,Composer 0.10 Release,https://web.archive.org/web/2023/https://www.mosaicml.com/blog/composer-0-10-release,,,TRUE,migrated-lost
dbx-e-composer-0-11-release,databricks,engineering,Composer 0.11 Release,https://web.archive.org/web/2023/https://www.mosaicml.com/blog/composer-0-11-release,,,TRUE,migrated-lost
dbx-e-composer-0-9-release,databricks,engineering,Composer 0.9 Release,https://web.archive.org/web/2023/https://www.mosaicml.com/blog/composer-0-9-release,,,TRUE,migrated-lost
dbx-e-composer-ffcv-faster-together,databricks,engineering,Composer + FFCV: Faster Together,https://web.archive.org/web/2023/https://www.mosaicml.com/blog/composer-ffcv-faster-together,,,TRUE,migrated-lost
dbx-r-dream3d,databricks,research,Dream3D,https://web.archive.org/web/2023/https://www.mosaicml.com/blog/dream3d,,,TRUE,migrated-lost
dbx-r-founders-blog,databricks,research,Founders Blog,https://web.archive.org/web/2023/https://www.mosaicml.com/blog/founders-blog,,,FALSE,company-news
dbx-e-genai-mosaicml-and-oracle,databricks,engineering,GenAI: MosaicML and Oracle,https://web.archive.org/web/2023/https://www.mosaicml.com/blog/genai-mosaicml-and-oracle,,,FALSE,company-news
dbx-e-inference-launch,databricks,engineering,Inference Launch,https://web.archive.org/web/2023/https://www.mosaicml.com/blog/inference-launch,,,FALSE,product-launch
dbx-e-introducing-mosaicml-cloud,databricks,engineering,Introducing MosaicML Cloud,https://web.archive.org/web/2023/https://www.mosaicml.com/blog/introducing-mosaicml-cloud,,,FALSE,product-launch
dbx-r-introducing-pubmed-gpt,databricks,research,Introducing PubMed GPT,https://web.archive.org/web/2023/https://www.mosaicml.com/blog/introducing-pubmed-gpt,,,TRUE,migrated-lost
dbx-r-making-ml-training-efficient-algorithmically,databricks,research,Making ML Training Efficient Algorithmically,https://web.archive.org/web/2023/https://www.mosaicml.com/blog/making-ml-training-efficient-algorithmically,,,TRUE,migrated-lost
dbx-r-metadialog-customer-spotlight,databricks,research,MetaDialog Customer Spotlight,https://web.archive.org/web/2023/https://www.mosaicml.com/blog/metadialog-customer-spotlight,,,FALSE,customer-story
dbx-r-methodology,databricks,research,Methodology,https://web.archive.org/web/2023/https://www.mosaicml.com/blog/methodology,,,TRUE,migrated-lost
dbx-e-mosaicml-cloud-demo,databricks,engineering,MosaicML Cloud Demo,https://web.archive.org/web/2023/https://www.mosaicml.com/blog/mosaicml-cloud-demo,,,FALSE,product-launch
dbx-r-mosaicml-databricks-generative-ai-for-all,databricks,research,MosaicML + Databricks: Generative AI for All,https://web.archive.org/web/2023/https://www.mosaicml.com/blog/mosaicml-databricks-generative-ai-for-all,,,FALSE,company-news
dbx-r-natural-synthetics,databricks,research,Natural Synthetics,https://web.archive.org/web/2023/https://www.mosaicml.com/blog/natural-synthetics,,,TRUE,migrated-lost
dbx-r-othersideai-customer-spotlight,databricks,research,OthersideAI Customer Spotlight,https://web.archive.org/web/2023/https://www.mosaicml.com/blog/othersideai-customer-spotlight,,,FALSE,customer-story
dbx-r-personal-ai-customer-spotlight,databricks,research,Personal AI Customer Spotlight,https://web.archive.org/web/2023/https://www.mosaicml.com/blog/personal-ai-customer-spotlight,,,FALSE,customer-story
dbx-r-replit,databricks,research,Replit Customer Spotlight,https://web.archive.org/web/2023/https://www.mosaicml.com/blog/replit,,,FALSE,customer-story
dbx-r-stable-diffusion-1,databricks,research,How We Trained Stable Diffusion for Less than $50k (Part 1),https://web.archive.org/web/2023/https://www.mosaicml.com/blog/stable-diffusion-1,,,TRUE,migrated-lost
dbx-r-stable-diffusion-part-3,databricks,research,Training Stable Diffusion from Scratch (Part 3),https://web.archive.org/web/2023/https://www.mosaicml.com/blog/stable-diffusion-part-3,,,TRUE,migrated-lost
dbx-r-stardog-customer-spotlight,databricks,research,Stardog Customer Spotlight,https://web.archive.org/web/2023/https://www.mosaicml.com/blog/stardog-customer-spotlight,,,FALSE,customer-story
dbx-e-supercharge-training-composer,databricks,engineering,Supercharge Training with Composer,https://web.archive.org/web/2023/https://www.mosaicml.com/blog/supercharge-training-composer,,,TRUE,migrated-lost
dbx-r-train-custom-gpt-diffusion-models,databricks,research,Train Custom GPT + Diffusion Models,https://web.archive.org/web/2023/https://www.mosaicml.com/blog/train-custom-gpt-diffusion-models,,,TRUE,migrated-lost
dbx-r-training-stable-diffusion-from-scratch-costs-160k,databricks,research,Training Stable Diffusion from Scratch Costs $160k,https://web.archive.org/web/2023/https://www.mosaicml.com/blog/training-stable-diffusion-from-scratch-costs-160k,,,TRUE,migrated-lost
dbx-r-training-stable-diffusion-from-scratch-part-2,databricks,research,Training Stable Diffusion from Scratch (Part 2),https://web.archive.org/web/2023/https://www.mosaicml.com/blog/training-stable-diffusion-from-scratch-part-2,,,TRUE,migrated-lost
dbx-r-twelve-labs,databricks,research,Twelve Labs Customer Spotlight,https://web.archive.org/web/2023/https://www.mosaicml.com/blog/twelve-labs,,,FALSE,customer-story
