id,summary,new_signal_learning,new_signal_novelty,new_signal_actionability,refined_subcategory
dsk-r-janus,"Janus-series: unified multimodal understanding and generation models that decouple visual encoding into separate pathways inside one autoregressive transformer; Janus-Pro-7B improves over Janus with larger model, more data, and optimized training, beating prior unified models and diffusion baselines on text-to-image benchmarks; JanusFlow variant uses rectified flow; Open-source models and demos available on HF; Strong signal for unified vision-language architectures from DeepSeek.",H,H,M,
hf-r-falconmamba,"Falcon Mamba 7B (TII) is the first general-purpose large-scale pure Mamba (attention-free SSM) model; Competitive with leading 7B transformers and hybrid SSMs on IFEval/BBH/MATH/GPQA/MUSR/MMLU-PRO; Constant memory and per-token time regardless of context length (fits on single A10 24GB); Trained on ~5500GT of curated data; Released under TII Falcon Mamba 7B license with HF Transformers support; Major data point on attention-free viability.",H,H,M,
hf-r-mixtral,"Mixtral 8x7B launch blog: Mistral's sparse MoE (8 experts, 2 active per token) decodes at 12B-dense speed but has 4x effective params; 32K context, Apache 2.0; Matches or beats Llama-2 70B and GPT-3.5 on several benchmarks; HF integrations: Transformers, TGI, TRL, 4-bit and GPTQ quantization; Canonical open-MoE reference release.",H,M,H,
hf-r-open-llm-leaderboard-drop,"Deep-dive explaining why DROP scores on the Open LLM Leaderboard were mysteriously low (<10 for most models); Root causes: number normalization breaking on non-space whitespace, and f1-on-bag-of-words penalizing long answers and wrong generation-end tokens; Found floating-point answers were never correctly scored; Shows generation-endpoint token choice was a major bug; Concrete case study in benchmark-evaluation pitfalls.",M,H,M,
hf-r-Lora-for-sequence-classification-with-Roberta-Llama-Mistral,"Tutorial comparing LoRA fine-tuning of RoBERTa-large (355M), Llama-2-7B, and Mistral-7B on disaster-tweet classification; Single-node A6000 48GB setup with PEFT/LoRA config for each; Covers weighted-loss custom Trainer, hyperparameter tuning, and final accuracy/F1 comparisons; Practical PEFT walkthrough rather than novel research; Useful onboarding for classification fine-tuning.",M,L,H,
